<?xml version="1.0" encoding="UTF-8" ?>
<!DOCTYPE pipeline SYSTEM "pipeline.dtd">

<!-- XML ligero para las pruebas -->
<!-- Carlos -->


<pipeline>

  <!-- Generador de imagenes -->
    <modulo ruta="camara" nombre="camara" inicio="1">
    <argumento nombre="camara">0</argumento>
    <argumento nombre="ancho">320</argumento>
    <argumento nombre="alto">240</argumento>
    <conexion puerto="salida_imagen">
      <destino puerto="entrada_imagen">ventana</destino>
    </conexion>
  </modulo>
    
  <!-- Ventana para el filtro de los parametros -->
  <modulo ruta="ventana_imagen" nombre="ventana">
    <argumento nombre="titulo">Ventana</argumento>
    <argumento nombre="nombre_foto">ventana.png</argumento>
    <argumento nombre="extension">png</argumento>
  </modulo>
</pipeline>
